{
  "schemaVersion": 1,
  "applicationId": "slack",
  "displayName": "Slack",
  "executables": [
    "slack.exe"
  ],
  "shortcuts": [
    {
      "gesture": "Ctrl+K",
      "function": "打开会话",
      "scope": "application",
      "confidence": "systemKnown",
      "sources": [
        "https://slack.com/help/articles/115003340723-Navigate-Slack-with-your-keyboard"
      ]
    },
    {
      "gesture": "Ctrl+G",
      "function": "开始搜索",
      "scope": "application",
      "confidence": "systemKnown",
      "sources": [
        "https://slack.com/help/articles/201374536-Slack-keyboard-shortcuts-and-commands"
      ]
    },
    {
      "gesture": "Ctrl+Shift+H",
      "function": "开始、加入、离开或结束 Huddle",
      "scope": "application",
      "confidence": "systemKnown",
      "sources": [
        "https://slack.com/help/articles/201374536-Slack-keyboard-shortcuts-and-commands"
      ]
    }
  ]
}
