{
  "schemaVersion": 1,
  "applicationId": "windows-system",
  "displayName": "Windows 系统",
  "executables": [],
  "shortcuts": [
    {
      "gesture": "Win+Shift+S",
      "function": "打开截图工具",
      "scope": "windowsSystem",
      "confidence": "systemKnown"
    },
    {
      "gesture": "Alt+Tab",
      "function": "切换窗口",
      "scope": "windowsSystem",
      "confidence": "systemKnown"
    },
    {
      "gesture": "Win+V",
      "function": "打开剪贴板历史记录",
      "scope": "windowsSystem",
      "confidence": "systemKnown"
    },
    {
      "gesture": "Win+L",
      "function": "锁定电脑",
      "scope": "windowsSystem",
      "confidence": "systemKnown"
    },
    {
      "gesture": "Win+G",
      "function": "打开 Xbox Game Bar",
      "scope": "windowsSystem",
      "confidence": "systemKnown"
    }
  ]
}
