{
  "schemaVersion": 1,
  "applicationId": "teams",
  "displayName": "Microsoft Teams",
  "executables": [
    "ms-teams.exe",
    "Teams.exe"
  ],
  "shortcuts": [
    {
      "gesture": "Ctrl+Shift+M",
      "function": "静音或解除静音",
      "scope": "application",
      "confidence": "systemKnown",
      "sources": [
        "https://support.microsoft.com/teams/meetings/mute-and-unmute-your-mic-in-microsoft-teams"
      ]
    },
    {
      "gesture": "Ctrl+G",
      "function": "转到聊天或频道",
      "scope": "application",
      "confidence": "systemKnown",
      "sources": [
        "https://support.microsoft.com/office/use-commands-in-microsoft-teams-88f61508-284d-417f-a53d-9e082164050b"
      ]
    }
  ]
}
