{
  "schemaVersion": 1,
  "applicationId": "excel",
  "displayName": "Microsoft Excel",
  "executables": [
    "EXCEL.EXE"
  ],
  "shortcuts": [
    {
      "gesture": "F2",
      "function": "编辑活动单元格",
      "scope": "application",
      "confidence": "systemKnown",
      "sources": [
        "https://support.microsoft.com/office/keyboard-shortcuts-in-excel-1798d9d5-842a-42b8-9c99-9b7213f0040f"
      ]
    },
    {
      "gesture": "Ctrl+S",
      "function": "保存工作簿",
      "scope": "application",
      "confidence": "systemKnown",
      "sources": [
        "https://support.microsoft.com/office/keyboard-shortcuts-in-excel-1798d9d5-842a-42b8-9c99-9b7213f0040f"
      ]
    },
    {
      "gesture": "Ctrl+B",
      "function": "应用加粗格式",
      "scope": "application",
      "confidence": "systemKnown",
      "sources": [
        "https://support.microsoft.com/office/keyboard-shortcuts-in-excel-1798d9d5-842a-42b8-9c99-9b7213f0040f"
      ]
    }
  ]
}
