{
  "schemaVersion": 1,
  "applicationId": "firefox",
  "displayName": "Mozilla Firefox",
  "executables": [
    "firefox.exe"
  ],
  "shortcuts": [
    {
      "gesture": "Ctrl+L",
      "function": "定位地址栏",
      "scope": "application",
      "confidence": "systemKnown",
      "sources": [
        "https://support.mozilla.org/kb/keyboard-shortcuts-perform-firefox-tasks-quickly"
      ]
    },
    {
      "gesture": "Ctrl+Shift+T",
      "function": "恢复关闭的标签页或窗口",
      "scope": "application",
      "confidence": "systemKnown",
      "sources": [
        "https://support.mozilla.org/kb/keyboard-shortcuts-perform-firefox-tasks-quickly"
      ]
    },
    {
      "gesture": "Ctrl+W",
      "function": "关闭当前标签页",
      "scope": "application",
      "confidence": "systemKnown",
      "sources": [
        "https://support.mozilla.org/kb/keyboard-shortcuts-perform-firefox-tasks-quickly"
      ]
    }
  ]
}
