{
  "schemaVersion": 1,
  "applicationId": "nvidia-app",
  "displayName": "NVIDIA App",
  "executables": [
    "NVIDIA App.exe"
  ],
  "shortcuts": [
    {
      "gesture": "Alt+Z",
      "function": "打开 NVIDIA 覆盖层（默认键，可修改）",
      "scope": "global",
      "confidence": "suspected"
    },
    {
      "gesture": "Alt+F1",
      "function": "保存截图（默认键，可修改）",
      "scope": "global",
      "confidence": "suspected"
    }
  ]
}
