{
  "schemaVersion": 1,
  "applicationId": "snipaste",
  "displayName": "Snipaste",
  "executables": [
    "Snipaste.exe"
  ],
  "shortcuts": [
    {
      "gesture": "F1",
      "function": "截图（默认键，可修改）",
      "scope": "global",
      "confidence": "suspected"
    },
    {
      "gesture": "F3",
      "function": "贴图（默认键，可修改）",
      "scope": "global",
      "confidence": "suspected"
    }
  ]
}
